{
    "alb_target_healthy": true,
    "assumed_role_arn": "arn:aws:iam::941035169846:role/dealbrain-production-gha-deploy",
    "aws_account_id": "941035169846",
    "aws_region": "us-east-1",
    "deploy_workflow_run_id": "34919890761",
    "deployment_duration_seconds": 22,
    "deployment_finished_at": "2026-09-15T02:07:16Z",
    "deployment_started_at": "2026-09-15T02:06:54Z",
    "ec2_instance_id": "i-0e49ddadd4ecc772d",
    "evidence_sha256": "3a40ae1ea22da0da14d4222d3b56f94aa2f5c38d6b3a7b793bdfca7cb4f5896e",
    "failure_reason": null,
    "final_status": "production_ok",
    "git_sha": "3c514943a8a0ec34d1df97d5a329d3acb4a86e07",
    "image_created_at": "2026-09-15T01:55:49Z",
    "image_digest": "sha256:e55021f1e07bae5f2fc8a3bab038c71dc28ccad5cdc5abe76760f0cb8b942d90",
    "image_id": "sha256:d50def1e0c18124709c0b07a03dba8ade08b3f724de9196a57849180ecb811d4",
    "image_repository": "ghcr.io/markbilbao/dealbrain",
    "localhost_live": true,
    "localhost_ready": true,
    "migration_revision_after": "d4e5f6a7b8c9",
    "migration_revision_before": "d4e5f6a7b8c9",
    "release_id": "rel-20260915T020323Z-3c514943a8a0",
    "repo_digest": "ghcr.io/markbilbao/dealbrain@sha256:e55021f1e07bae5f2fc8a3bab038c71dc28ccad5cdc5abe76760f0cb8b942d90",
    "role_session_name": "gha-34919890761-production",
    "schema_version": 1,
    "smoke_ok": true,
    "source_manifest_sha256": "c4763a622c4684d10a8c63c873b30c99942547715aa87d2b1467bb187814d7f9",
    "ssm_command_id": "4fcf0ab2-f667-4e17-9a9c-0a67ab955683"
}
